{
  "$schema": "./standard_modules.schema.json",
  "schemaVersion": "1.0.0",
  "standardVersion": "1.5.0-beta.1",
  "migrationStage": "logical-mapping",
  "baselineSha256": "d0c337fd2dc69b9343b6ddc500b0c4209947dca5288f3b6a017662abc7081caf",
  "modules": [
    {
      "id": "das.core",
      "title": "Core adoption and profiles",
      "effect": "normative",
      "status": "draft",
      "activation": {
        "op": "const",
        "value": true
      },
      "dependsOn": [],
      "normativeSources": [
        "SPECIFICATION.md",
        "modules/edition-1.5.md",
        "appendices/appendix-g-ai-product-engineering-principles-addendum.md",
        "appendices/appendix-l-tooling-standard.md",
        "DAS_DEPLOYMENT_ADDENDUM.md",
        "DAS_GOVERNANCE_COLLABORATION.md",
        "CHANGELOG.md",
        "DAS_STANDARD_CONTEXT_PACK.md",
        "appendices/appendix-c-project-master-doc-template.md",
        "appendices/appendix-e-multi-repo-contract-driven-standard.md"
      ],
      "clauseIds": [
        "cl-2.1",
        "cl-2.3",
        "cl-2.4",
        "cl-2.5",
        "cl-13.1",
        "cl-13.2",
        "cl-13.3",
        "cl-13.18",
        "A-G"
      ],
      "legacyUnitIds": [
        "legacy-text-de7276bb-0001",
        "legacy-text-de7276bb-0002",
        "legacy-text-de7276bb-0003",
        "legacy-text-de7276bb-0004",
        "legacy-text-de7276bb-0005",
        "legacy-text-de7276bb-0006",
        "legacy-text-de7276bb-0007",
        "legacy-text-de7276bb-0008",
        "legacy-text-de7276bb-0009",
        "legacy-text-de7276bb-0010",
        "legacy-text-de7276bb-0011",
        "legacy-text-de7276bb-0012",
        "legacy-text-de7276bb-0013",
        "legacy-text-de7276bb-0014",
        "legacy-text-de7276bb-0015",
        "legacy-text-de7276bb-0016",
        "legacy-text-de7276bb-0102",
        "legacy-text-de7276bb-0160",
        "legacy-text-de7276bb-0161",
        "legacy-text-de7276bb-0162",
        "legacy-text-38706f1d-0001",
        "legacy-text-38706f1d-0002",
        "legacy-text-38706f1d-0003",
        "legacy-text-38706f1d-0004",
        "legacy-text-38706f1d-0005"
      ],
      "requiredArtifactRefs": [
        "standard_manifest.schema.json",
        "clause_index.json",
        "modules/edition-1.5.md"
      ],
      "gates": [
        "module-ownership"
      ],
      "introducedIn": "1.5.0-beta.1"
    },
    {
      "id": "das.architecture-modularity",
      "title": "Architecture and software modularity",
      "effect": "normative",
      "status": "draft",
      "activation": {
        "op": "const",
        "value": true
      },
      "dependsOn": [
        "das.core"
      ],
      "normativeSources": [
        "SPECIFICATION.md",
        "appendices/appendix-e-multi-repo-contract-driven-standard.md",
        "appendices/appendix-f-sdmm-refactoring-migration-playbook.md",
        "appendices/appendix-i-ddd-playbook.md",
        "appendices/appendix-g-ai-product-engineering-principles-addendum.md",
        "appendices/appendix-j-bdd-scenarios-verification-playbook.md",
        "DAS_STANDARD_CONTEXT_PACK.md",
        "appendices/appendix-c-project-master-doc-template.md"
      ],
      "clauseIds": [
        "cl-12.1",
        "cl-12.2",
        "cl-12.3",
        "cl-12.4",
        "cl-12.5",
        "cl-12.6",
        "cl-3.1",
        "cl-3.3",
        "cl-3.4",
        "cl-3.5",
        "cl-3.6",
        "cl-5.2",
        "cl-5.3",
        "cl-5.4",
        "cl-5.7",
        "A-G",
        "A-F",
        "A-I",
        "A-J",
        "A-E"
      ],
      "legacyUnitIds": [
        "legacy-text-de7276bb-0017",
        "legacy-text-de7276bb-0018",
        "legacy-text-de7276bb-0019",
        "legacy-text-de7276bb-0020",
        "legacy-text-de7276bb-0021",
        "legacy-text-de7276bb-0022",
        "legacy-text-de7276bb-0023",
        "legacy-text-de7276bb-0024",
        "legacy-text-de7276bb-0025",
        "legacy-text-de7276bb-0026",
        "legacy-text-de7276bb-0027",
        "legacy-text-de7276bb-0028",
        "legacy-text-de7276bb-0029",
        "legacy-text-de7276bb-0030",
        "legacy-text-de7276bb-0058",
        "legacy-text-de7276bb-0059",
        "legacy-text-de7276bb-0060",
        "legacy-text-de7276bb-0061",
        "legacy-text-de7276bb-0062",
        "legacy-text-de7276bb-0063",
        "legacy-text-de7276bb-0064",
        "legacy-text-de7276bb-0065",
        "legacy-text-de7276bb-0066",
        "legacy-text-de7276bb-0067",
        "legacy-text-de7276bb-0146",
        "legacy-text-de7276bb-0147",
        "legacy-text-de7276bb-0148",
        "legacy-text-de7276bb-0149",
        "legacy-text-de7276bb-0150",
        "legacy-text-de7276bb-0151",
        "legacy-text-de7276bb-0152",
        "legacy-text-de7276bb-0153",
        "legacy-text-de7276bb-0154",
        "legacy-text-de7276bb-0155",
        "legacy-text-de7276bb-0156",
        "legacy-text-de7276bb-0157",
        "legacy-text-de7276bb-0158",
        "legacy-text-de7276bb-0159",
        "legacy-text-165796df-0001",
        "legacy-text-165796df-0002",
        "legacy-text-165796df-0003",
        "legacy-text-165796df-0004",
        "legacy-text-165796df-0005",
        "legacy-text-165796df-0006",
        "legacy-text-165796df-0007",
        "legacy-text-165796df-0008",
        "legacy-text-165796df-0009",
        "legacy-text-165796df-0010",
        "legacy-text-165796df-0011",
        "legacy-text-165796df-0012",
        "legacy-text-165796df-0013",
        "legacy-text-165796df-0014",
        "legacy-text-165796df-0015",
        "legacy-text-165796df-0026",
        "legacy-text-165796df-0027",
        "legacy-text-165796df-0039",
        "legacy-text-165796df-0041",
        "legacy-text-165796df-0042",
        "legacy-text-165796df-0045",
        "legacy-text-165796df-0047",
        "legacy-text-165796df-0048",
        "legacy-text-165796df-0049",
        "legacy-text-165796df-0050",
        "legacy-text-165796df-0051",
        "legacy-text-165796df-0052",
        "legacy-text-165796df-0053",
        "legacy-text-165796df-0054",
        "legacy-text-165796df-0055",
        "legacy-text-165796df-0056",
        "legacy-text-165796df-0057",
        "legacy-text-165796df-0058",
        "legacy-text-165796df-0059",
        "legacy-text-165796df-0060",
        "legacy-text-165796df-0061",
        "legacy-text-165796df-0062",
        "legacy-text-165796df-0063",
        "legacy-text-165796df-0064",
        "legacy-text-165796df-0065",
        "legacy-text-165796df-0066",
        "legacy-text-165796df-0067",
        "legacy-text-165796df-0068",
        "legacy-text-165796df-0069",
        "legacy-text-165796df-0070",
        "legacy-text-165796df-0071",
        "legacy-text-165796df-0072",
        "legacy-text-165796df-0073",
        "legacy-text-165796df-0074",
        "legacy-text-165796df-0075",
        "legacy-text-165796df-0076",
        "legacy-text-165796df-0077",
        "legacy-text-165796df-0078",
        "legacy-text-165796df-0079",
        "legacy-text-165796df-0080",
        "legacy-text-165796df-0081",
        "legacy-text-165796df-0082",
        "legacy-text-165796df-0083",
        "legacy-text-e80f2d11-0001",
        "legacy-text-e80f2d11-0002",
        "legacy-text-329162a7-0001",
        "legacy-text-329162a7-0002",
        "legacy-text-329162a7-0003",
        "legacy-text-329162a7-0004",
        "legacy-text-329162a7-0005",
        "legacy-text-329162a7-0006",
        "legacy-text-329162a7-0007",
        "legacy-text-38706f1d-0006",
        "legacy-text-38706f1d-0007",
        "legacy-text-38706f1d-0008",
        "legacy-text-38706f1d-0009",
        "legacy-text-38706f1d-0010",
        "legacy-text-38706f1d-0011",
        "legacy-text-38706f1d-0012",
        "legacy-text-38706f1d-0013",
        "legacy-text-38706f1d-0014",
        "legacy-text-38706f1d-0015",
        "legacy-text-38706f1d-0016",
        "legacy-text-38706f1d-0017",
        "legacy-text-38706f1d-0018",
        "legacy-text-38706f1d-0019",
        "legacy-text-38706f1d-0020",
        "legacy-text-38706f1d-0021",
        "legacy-text-38706f1d-0022",
        "legacy-text-38706f1d-0023",
        "legacy-text-38706f1d-0024",
        "legacy-text-38706f1d-0025",
        "legacy-text-38706f1d-0026",
        "legacy-text-38706f1d-0027",
        "legacy-guide-e80f2d11-required",
        "legacy-guide-e80f2d11-cutover",
        "legacy-text-d2a39e69-0001",
        "legacy-text-d2a39e69-0002",
        "legacy-text-d2a39e69-0003",
        "legacy-text-d2a39e69-0004",
        "legacy-text-d2a39e69-0005",
        "legacy-text-d2a39e69-0006",
        "legacy-text-d2a39e69-0007"
      ],
      "requiredArtifactRefs": [
        "standard_manifest.schema.json",
        "clause_index.json"
      ],
      "gates": [
        "module-ownership"
      ],
      "introducedIn": "1.5.0-beta.1"
    },
    {
      "id": "das.contracts-compatibility",
      "title": "Contracts and compatibility",
      "effect": "normative",
      "status": "draft",
      "activation": {
        "op": "const",
        "value": true
      },
      "dependsOn": [
        "das.core"
      ],
      "normativeSources": [
        "SPECIFICATION.md",
        "modules/edition-1.5.md",
        "appendices/appendix-e-multi-repo-contract-driven-standard.md",
        "appendices/appendix-g-ai-product-engineering-principles-addendum.md",
        "DAS_GOVERNANCE_COLLABORATION.md",
        "appendices/appendix-c-project-master-doc-template.md"
      ],
      "clauseIds": [
        "cl-4.1",
        "cl-4.2",
        "cl-4.3",
        "cl-4.4",
        "cl-4.5",
        "cl-13.4",
        "cl-13.5",
        "cl-13.6",
        "cl-13.7",
        "cl-13.8",
        "cl-13.15",
        "A-E",
        "A-G"
      ],
      "legacyUnitIds": [
        "legacy-text-165796df-0016",
        "legacy-text-165796df-0017",
        "legacy-text-165796df-0018",
        "legacy-text-165796df-0019",
        "legacy-text-165796df-0020",
        "legacy-text-165796df-0021",